{
  "schemaVersion": "2026-05-30.workflow-plugin.revision-request.v1",
  "generatedAt": "2026-05-30T13:20:00Z",
  "draftId": "workflow_draft_lesson_archive_review",
  "sourceKind": "SANDBOX_FAILURE",
  "sourceEvidenceId": "sandbox_run_lesson_archive_review_001",
  "revisionDecision": "REVISION_REQUIRED",
  "saveBlocked": true,
  "issues": [
    "contract test failed: missing archive item guard"
  ],
  "recommendedActions": [
    "Revise generated files using the preserved sandbox feedback.",
    "Re-run sandbox tests before requesting human approval again."
  ]
}
